{
  "$comment": "Runner / Bullet Runner 共通の区間パターン集。plan/spec-pattern-system.md 参照。座標系: x=パターン起点からの水平距離px、y=地面からの高さpx（0=地面、正の値=上）。全パターン共通の固定長 patternLengthPx を使用する。地面は常に連続する（穴は仕様変更で撤廃済み。トゲ・足場・バネの密度を上げて対応）。",
  "section": "runner_patterns",
  "patternLengthPx": 900,
  "patterns": [
    {
      "id": "r_001_spike_gauntlet_basic",
      "entries": [
        { "kind": "spike", "x": 260, "y": 0, "w": 30, "h": 44 },
        { "kind": "spike", "x": 400, "y": 0, "w": 30, "h": 44 },
        { "kind": "spike", "x": 540, "y": 0, "w": 30, "h": 44 },
        { "kind": "oneWayPlatform", "x": 680, "y": 120, "w": 100, "h": 16 }
      ]
    },
    {
      "id": "r_002_spike_pair_tight",
      "entries": [
        { "kind": "spike", "x": 280, "y": 0, "w": 30, "h": 44 },
        { "kind": "spike", "x": 330, "y": 0, "w": 30, "h": 44 },
        { "kind": "spike", "x": 500, "y": 0, "w": 30, "h": 44 },
        { "kind": "spike", "x": 550, "y": 0, "w": 30, "h": 44 },
        { "kind": "oneWayPlatform", "x": 700, "y": 160, "w": 100, "h": 16 }
      ]
    },
    {
      "id": "r_003_spike_triple_chain",
      "entries": [
        { "kind": "spike", "x": 220, "y": 0, "w": 30, "h": 44 },
        { "kind": "spike", "x": 360, "y": 0, "w": 30, "h": 44 },
        { "kind": "spike", "x": 500, "y": 0, "w": 30, "h": 44 },
        { "kind": "spike", "x": 640, "y": 0, "w": 30, "h": 44 },
        { "kind": "oneWayPlatform", "x": 780, "y": 110, "w": 90, "h": 16 }
      ]
    },
    {
      "id": "r_004_platform_staircase",
      "entries": [
        { "kind": "spike", "x": 250, "y": 0, "w": 28, "h": 44 },
        { "kind": "oneWayPlatform", "x": 200, "y": 90, "w": 90, "h": 16 },
        { "kind": "oneWayPlatform", "x": 350, "y": 150, "w": 90, "h": 16 },
        { "kind": "oneWayPlatform", "x": 500, "y": 210, "w": 90, "h": 16 },
        { "kind": "spike", "x": 620, "y": 0, "w": 28, "h": 44 },
        { "kind": "spike", "x": 760, "y": 0, "w": 28, "h": 44 }
      ]
    },
    {
      "id": "r_005_spike_dense",
      "entries": [
        { "kind": "spike", "x": 200, "y": 0, "w": 28, "h": 44 },
        { "kind": "spike", "x": 300, "y": 0, "w": 28, "h": 44 },
        { "kind": "spike", "x": 400, "y": 0, "w": 28, "h": 44 },
        { "kind": "spike", "x": 500, "y": 0, "w": 28, "h": 44 },
        { "kind": "spike", "x": 600, "y": 0, "w": 28, "h": 44 },
        { "kind": "oneWayPlatform", "x": 750, "y": 130, "w": 90, "h": 16 }
      ]
    },
    {
      "id": "r_006_double_jump_challenge",
      "entries": [
        { "kind": "spike", "x": 300, "y": 0, "w": 30, "h": 44 },
        { "kind": "spike", "x": 340, "y": 0, "w": 30, "h": 44 },
        { "kind": "spike", "x": 550, "y": 0, "w": 30, "h": 44 },
        { "kind": "oneWayPlatform", "x": 700, "y": 190, "w": 100, "h": 16 }
      ]
    },
    {
      "id": "r_007_spring_launch",
      "entries": [
        { "kind": "spring", "x": 220, "y": 0, "w": 40, "h": 28 },
        { "kind": "oneWayPlatform", "x": 400, "y": 200, "w": 140, "h": 16 },
        { "kind": "spike", "x": 600, "y": 0, "w": 30, "h": 44 },
        { "kind": "spike", "x": 700, "y": 0, "w": 30, "h": 44 }
      ]
    },
    {
      "id": "r_008_moving_platform",
      "entries": [
        { "kind": "oneWayPlatform", "x": 300, "y": 110, "w": 100, "h": 16, "driftEnabled": true },
        { "kind": "spike", "x": 480, "y": 0, "w": 30, "h": 44 },
        { "kind": "spike", "x": 520, "y": 0, "w": 30, "h": 44 },
        { "kind": "oneWayPlatform", "x": 680, "y": 160, "w": 100, "h": 16 }
      ]
    },
    {
      "id": "r_009_conveyor",
      "entries": [
        { "kind": "oneWayPlatform", "x": 280, "y": 90, "w": 120, "h": 16, "conveyorVx": 90 },
        { "kind": "spike", "x": 480, "y": 0, "w": 30, "h": 44 },
        { "kind": "spike", "x": 600, "y": 0, "w": 30, "h": 44 },
        { "kind": "oneWayPlatform", "x": 750, "y": 150, "w": 90, "h": 16 }
      ]
    },
    {
      "id": "r_010_spike_wall",
      "entries": [
        { "kind": "spike", "x": 250, "y": 0, "w": 30, "h": 44 },
        { "kind": "spike", "x": 290, "y": 0, "w": 30, "h": 44 },
        { "kind": "spike", "x": 330, "y": 0, "w": 30, "h": 44 },
        { "kind": "spike", "x": 370, "y": 0, "w": 30, "h": 44 },
        { "kind": "oneWayPlatform", "x": 600, "y": 130, "w": 100, "h": 16 },
        { "kind": "spike", "x": 780, "y": 0, "w": 30, "h": 44 }
      ]
    },
    {
      "id": "r_011_platform_zigzag",
      "entries": [
        { "kind": "spike", "x": 260, "y": 0, "w": 28, "h": 44 },
        { "kind": "oneWayPlatform", "x": 220, "y": 100, "w": 90, "h": 16 },
        { "kind": "oneWayPlatform", "x": 380, "y": 190, "w": 90, "h": 16 },
        { "kind": "oneWayPlatform", "x": 540, "y": 100, "w": 90, "h": 16 },
        { "kind": "spike", "x": 460, "y": 0, "w": 28, "h": 44 },
        { "kind": "spike", "x": 660, "y": 0, "w": 28, "h": 44 }
      ]
    },
    {
      "id": "r_012_gauntlet_mixed",
      "entries": [
        { "kind": "spike", "x": 200, "y": 0, "w": 28, "h": 44 },
        { "kind": "spike", "x": 240, "y": 0, "w": 28, "h": 44 },
        { "kind": "oneWayPlatform", "x": 360, "y": 130, "w": 90, "h": 16 },
        { "kind": "spring", "x": 520, "y": 0, "w": 40, "h": 28 },
        { "kind": "oneWayPlatform", "x": 650, "y": 210, "w": 100, "h": 16 },
        { "kind": "spike", "x": 800, "y": 0, "w": 28, "h": 44 }
      ]
    },
    {
      "id": "r_013_wide_spike_wall",
      "entries": [
        { "kind": "spike", "x": 250, "y": 0, "w": 30, "h": 44 },
        { "kind": "spike", "x": 300, "y": 0, "w": 30, "h": 44 },
        { "kind": "spike", "x": 350, "y": 0, "w": 30, "h": 44 },
        { "kind": "spike", "x": 400, "y": 0, "w": 30, "h": 44 },
        { "kind": "oneWayPlatform", "x": 620, "y": 150, "w": 100, "h": 16 }
      ]
    },
    {
      "id": "r_014_spring_platform_combo",
      "entries": [
        { "kind": "spring", "x": 200, "y": 0, "w": 40, "h": 28 },
        { "kind": "oneWayPlatform", "x": 350, "y": 200, "w": 110, "h": 16 },
        { "kind": "spring", "x": 560, "y": 0, "w": 40, "h": 28 },
        { "kind": "oneWayPlatform", "x": 700, "y": 220, "w": 110, "h": 16 },
        { "kind": "spike", "x": 850, "y": 0, "w": 28, "h": 44 }
      ]
    }
  ]
}
